[
  {
    "id": "A-001",
    "status": "Passed",
    "prompt_path": "runs/A-001/A-001-prompt.txt",
    "oracle_path": null,
    "run_path": "runs/A-001",
    "evidence": [
      "runs/A-001/A-001.md",
      "runs/A-001/A-001-prompt.txt",
      "runs/A-001/setup-api.json",
      "runs/A-001/A-001-final.md",
      "runs/A-001/A-001-independent.json",
      "runs/A-001/git-snapshot.json",
      "runs/A-001/assessment.json"
    ],
    "native_transcript": null,
    "assessment": "Independent inspection: 7 governing documents, SPEC exact contracts, early end-to-end PLAN with phase exits, 8 uniquely owned unchecked tasks. No product source/tests. Preparation e750d1c pushed, main remote equality observed; explicit-source mode only.",
    "assessed_at": "2026-10-02T13:21:09.803237+00:00"
  },
  {
    "id": "A-002",
    "status": "Passed",
    "prompt_path": "runs/A-002/A-002-prompt.txt",
    "oracle_path": null,
    "run_path": "runs/A-002",
    "evidence": [
      "runs/A-002/A-002.md",
      "runs/A-002/A-002-prompt.txt",
      "runs/A-002/git-snapshot.json",
      "runs/A-002/A-002-final.md",
      "runs/A-002/assessment.json",
      "runs/A-002/A-002-independent.json"
    ],
    "native_transcript": null,
    "assessment": "Selection output correctly resolves T-001 and T-001..T-003 milestone1.1, same phase owner, no external prerequisite; partial phase pause. Independent state remains clean main e750d1c; consumer journal records no tests/push/branch/mutation.",
    "assessed_at": "2026-10-02T13:25:15.007584+00:00"
  },
  {
    "id": "A-003",
    "status": "Passed",
    "prompt_path": "runs/A-003/A-003-resume-prompt.txt",
    "oracle_path": null,
    "run_path": "runs/A-003",
    "evidence": [
      "runs/A-003/A-003-first-independent.json",
      "runs/A-003/A-003-labels-2.json",
      "runs/A-003/A-003-resume2-final.md",
      "runs/A-003/A-003-resume1-created.json",
      "runs/A-003/A-003-resume1.md",
      "runs/A-003/A-003-resume-prompt.txt",
      "runs/A-003/git-snapshot.json",
      "runs/A-003/A-003-milestones-2.1.json",
      "runs/A-003/A-003-milestones-1.1.json",
      "runs/A-003/A-003-connector-issue-attempt.json",
      "runs/A-003/A-003-resume1-issue-drafts.json",
      "runs/A-003/A-003-resume2-prompt.txt",
      "runs/A-003/A-003-final.md",
      "runs/A-003/A-003-resume1-after.json",
      "runs/A-003/A-003.md",
      "runs/A-003/A-003-resume2-before.json",
      "runs/A-003/A-003-labels-1.json",
      "runs/A-003/A-003-resume1-before.json",
      "runs/A-003/A-003-prompt.txt",
      "runs/A-003/A-003-second-independent.json",
      "runs/A-003/A-003-projection.json",
      "runs/A-003/A-003-milestones-1.2.json",
      "runs/A-003/A-003-resume2.md",
      "runs/A-003/assessment.json",
      "runs/A-003/A-003-resume1-final.md",
      "runs/A-003/A-003-milestones-2.2.json",
      "runs/A-003/A-003-foreign-seed.json",
      "runs/A-003/A-003-parent-api.py"
    ],
    "native_transcript": null,
    "assessment": "Actual first and second agent synchronizations independently verified. 8 unique exact task issues #1..8,2 phase labels,4 native milestones, correct initial parents/open states. Second sync reused all IDs with no duplicates/changes; seeded foreign T-001 body and label preserved. Original connector403 and protected PAT recovery/creation evidence retained. Live main clean d769b55; no implementation.",
    "assessed_at": "2026-10-02T16:04:55.274778+00:00"
  },
  {
    "id": "A-004",
    "status": "Passed",
    "prompt_path": "runs/A-004/A-004-prompt.txt",
    "oracle_path": null,
    "run_path": "runs/A-004",
    "evidence": [
      "runs/A-004/A-004-final.md",
      "runs/A-004/git-snapshot.json",
      "runs/A-004/A-004-independent.json",
      "runs/A-004/A-004-prompt.txt",
      "runs/A-004/A-004.md",
      "runs/A-004/assessment.json"
    ],
    "native_transcript": null,
    "assessment": "Actual first task T-001 on phase1: observed behavioral RED and9-test GREEN/full verification, professional docs, task commit3b201a3 pushed and issue1 completed with evidence. Independent literal API/BOM/newline/immutability checks passed; main d769b55 unchanged, no CLI/next task/partial merge. Foreign issue body/label retained.",
    "assessed_at": "2026-10-02T16:24:26.173092+00:00"
  },
  {
    "id": "A-005",
    "status": "Passed",
    "prompt_path": "runs/A-005/A-006-prompt.txt",
    "oracle_path": null,
    "run_path": "runs/A-005",
    "evidence": [
      "runs/A-005/A-005-T002-full.log",
      "runs/A-005/A-006-prompt.txt",
      "runs/A-005/A-005.md",
      "runs/A-005/A-005-T002-green.log",
      "runs/A-005/A-005-layout-full.log",
      "runs/A-005/A-005-interruption-diagnosis.json",
      "runs/A-005/A-005-T002-red.log",
      "runs/A-005/git-snapshot.json",
      "runs/A-005/A-005-cli-independent.json",
      "runs/A-005/A-005-T003-green.log",
      "runs/A-005/A-005-layout-focused.log",
      "runs/A-005/A-005-state-independent.json",
      "runs/A-005/A-005-T003-full.log",
      "runs/A-005/A-005-suite-independent.json",
      "runs/A-005/A-005-milestone-demo.log",
      "runs/A-005/A-005-prompt.txt",
      "runs/A-005/A-005-T003-red.log",
      "runs/A-005/assessment.json",
      "runs/A-005/A-005-final.md"
    ],
    "native_transcript": null,
    "assessment": "Milestone1.1: 17 discovered tests and eight independent literal named-file CLI cases passed; T-0029042c20/T-0038836c49 published on paused phase1, issues2/3 completed, main unchanged. Test layout corrected with original moved test bytes preserved; TST-001 resolved. Historical RED/interruption retained. Raw hosted payload publication blocked by auto-review and omitted; only task-state checks retained.",
    "assessed_at": "2026-10-02T16:56:28.585147+00:00"
  },
  {
    "id": "A-006",
    "status": "Pending",
    "prompt_path": null,
    "oracle_path": null,
    "run_path": null,
    "evidence": [],
    "native_transcript": null,
    "assessment": null,
    "assessed_at": null
  },
  {
    "id": "A-007",
    "status": "Pending",
    "prompt_path": null,
    "oracle_path": null,
    "run_path": null,
    "evidence": [],
    "native_transcript": null,
    "assessment": null,
    "assessed_at": null
  },
  {
    "id": "A-008",
    "status": "Pending",
    "prompt_path": null,
    "oracle_path": null,
    "run_path": null,
    "evidence": [],
    "native_transcript": null,
    "assessment": null,
    "assessed_at": null
  },
  {
    "id": "A-009",
    "status": "Pending",
    "prompt_path": null,
    "oracle_path": null,
    "run_path": null,
    "evidence": [],
    "native_transcript": null,
    "assessment": null,
    "assessed_at": null
  },
  {
    "id": "A-010",
    "status": "Pending",
    "prompt_path": null,
    "oracle_path": null,
    "run_path": null,
    "evidence": [],
    "native_transcript": null,
    "assessment": null,
    "assessed_at": null
  },
  {
    "id": "A-011",
    "status": "Pending",
    "prompt_path": null,
    "oracle_path": null,
    "run_path": null,
    "evidence": [],
    "native_transcript": null,
    "assessment": null,
    "assessed_at": null
  },
  {
    "id": "A-012",
    "status": "Pending",
    "prompt_path": null,
    "oracle_path": null,
    "run_path": null,
    "evidence": [],
    "native_transcript": null,
    "assessment": null,
    "assessed_at": null
  },
  {
    "id": "A-013",
    "status": "Pending",
    "prompt_path": null,
    "oracle_path": null,
    "run_path": null,
    "evidence": [],
    "native_transcript": null,
    "assessment": null,
    "assessed_at": null
  },
  {
    "id": "A-014",
    "status": "Running",
    "prompt_path": "runs/A-014/A-014-prerequisite-prompt.txt",
    "oracle_path": null,
    "run_path": "runs/A-014",
    "evidence": [
      "runs/A-014/git-snapshot.json",
      "runs/A-014/A-014-prerequisite.md",
      "runs/A-014/A-014-prerequisite-independent.json",
      "runs/A-014/A-014-prerequisite-setup.json",
      "runs/A-014/A-014-prerequisite-final.md",
      "runs/A-014/assessment.json",
      "runs/A-014/A-014-prerequisite-prompt.txt"
    ],
    "native_transcript": null,
    "assessment": "Out-of-range prerequisite subcase independently verified: T-003..T-006 request blocked by unchecked/unimplemented T-002; no edits/tests/publication/branch transition. Sequential cross-phase subcase remains pending.",
    "assessed_at": "2026-10-02T16:42:06.764739+00:00"
  },
  {
    "id": "A-015",
    "status": "Passed",
    "prompt_path": "runs/A-015/A-015-resume-prompt.txt",
    "oracle_path": null,
    "run_path": "runs/A-015",
    "evidence": [
      "runs/A-015/A-015-resume.md",
      "runs/A-015/git-snapshot.json",
      "runs/A-015/A-015-resume-final.md",
      "runs/A-015/A-015-resume-prompt.txt",
      "runs/A-015/A-015-resume-setup.json",
      "runs/A-015/A-015-green.log",
      "runs/A-015/A-015.md",
      "runs/A-015/A-015-checkpoint.bundle",
      "runs/A-015/A-015-resume-independent.json",
      "runs/A-015/A-015-independent.json",
      "runs/A-015/A-015-final.md",
      "runs/A-015/assessment.json",
      "runs/A-015/A-015-verify.log",
      "runs/A-015/A-015-red.log",
      "runs/A-015/A-015-prompt.txt"
    ],
    "native_transcript": null,
    "assessment": "Original actual pre-commit rejection preserved. Fresh consumer resumed checked/verified T-001, rechecked7 tests, committed35df4a0 and pushed isolated phase origin; stopped without T-002/merge. Independent hashes of all5 code/test files exactly match pre-resume, proving no reimplementation; main e750d1c unchanged, remote phase equals commit. Controlled hook release explicitly recorded.",
    "assessed_at": "2026-10-02T15:54:31.011452+00:00"
  },
  {
    "id": "A-016",
    "status": "Passed",
    "prompt_path": "runs/A-016/A-016-prompt.txt",
    "oracle_path": null,
    "run_path": "runs/A-016",
    "evidence": [
      "runs/A-016/A-016-setup.json",
      "runs/A-016/A-016-independent.json",
      "runs/A-016/git-snapshot.json",
      "runs/A-016/A-016.md",
      "runs/A-016/A-016-final.md",